folder,favorite,type,name,notes,fields,reprompt,login_uri,login_username,login_password,login_totp
"SA / Passwords",1,login,"Keycloak SSO","SSO login for all private services (n8n, LiteLLM, JupyterLab, Vaultwarden, Open WebUI, Portal)",,0,"https://kc.sovereignadvisory.ai/realms/agentic-sdlc/account","relder","2f9c958ec51a27466abb4505",
"SA / Passwords",0,login,"Keycloak Admin Console","Admin access to manage users and SSO clients. Moved to public KC URL (KC_HOSTNAME_ADMIN split removed 2026-03-19)",,1,"https://kc.sovereignadvisory.ai/admin/","admin","1qWWd124Vw4IfFEzFLGGg6TG5wdSnVvg",
"SA / Passwords",0,login,"Vaultwarden Admin Panel","Admin token for Vaultwarden configuration (paste as token not password)",,1,"https://vault.private.sovereignadvisory.ai/admin","admin","vw-admin-debe56ee15a7452f1a9bca7a",
"SA / Passwords",0,login,"n8n Login","n8n editor form login (after Keycloak SSO)",,0,"https://n8n.private.sovereignadvisory.ai","relder@sovereignadvisory.ai","VibeAdmin2026!",
"SA / Passwords",0,login,"JupyterLab Token","Token required after passing through SSO",,0,"https://jupyter.private.sovereignadvisory.ai","token","vibe-dev-token",
"SA / API Keys",0,login,"LiteLLM Master API Key","Master API key for the LiteLLM proxy. Use as: Authorization: Bearer <key>",,1,"https://litellm.private.sovereignadvisory.ai","apikey","sk-vibe-coding-key-123",
"SA / API Keys",0,login,"n8n API Key (JWT)","JWT Bearer token for n8n REST API. Expires 2027-03.","Base URL: https://n8n.private.sovereignadvisory.ai/api/v1",0,"https://n8n.private.sovereignadvisory.ai","apikey","eyJhbGciOiJIUzI1NiIsInR5cCI6IkpXVCJ9.eyJzdWIiOiIyMjA5OGVkZC02NzIyLTRhODEtYWNmNS04OTk2YzRkNzIzNjUiLCJpc3MiOiJuOG4iLCJhdWQiOiJwdWJsaWMtYXBpIiwianRpIjoiMzVkNzFiYTQtZmM0Mi00YzUwLWIyMDEtZjI4N2MzYzA4NjczIiwiaWF0IjoxNzczMzUyNTkwLCJleHAiOjE4MDQ4ODg1OTA5NDJ9.u8czABqGWnB4dKqBXYGrGgvmCyHbUkWYz47KLH7n5Wo",
"SA / Infrastructure",0,login,"Production VPS — Root","SSH/console access to VPS. Real IP: 187.77.208.197 (use for SSH — Twingate intercepts local DNS). Stack: /opt/agentic-sdlc/",,1,"https://sovereignadvisory.ai","root","Purse0nal10ass1ty!",
